{
  "title": "Tiny Cafe",
  "slug": "tiny-cafe",
  "status": "released",
  "releaseDate": "2024-05-20",
  "platforms": [
    "Windows",
    "macOS",
    "Web"
  ],
  "tags": [
    "Simulation",
    "Management",
    "Casual",
    "Relaxing"
  ],
  "coverImage": "/assets/images/games/tiny-cafe-cover.jpg",
  "screenshots": [
    {
      "url": "/assets/images/games/tiny-cafe-1.jpg",
      "alt": "Tiny Cafe screenshot 1"
    },
    {
      "url": "/assets/images/games/tiny-cafe-2.jpg",
      "alt": "Tiny Cafe screenshot 2"
    },
    {
      "url": "/assets/images/games/tiny-cafe-3.jpg",
      "alt": "Tiny Cafe screenshot 3"
    },
    {
      "url": "/assets/images/games/tiny-cafe-4.jpg",
      "alt": "Tiny Cafe screenshot 4"
    },
    {
      "url": "/assets/images/games/tiny-cafe-5.jpg",
      "alt": "Tiny Cafe screenshot 5"
    }
  ],
  "features": [
    "Extensive cafe customization options",
    "Recipe creation and experimentation",
    "Regular customer relationships and stories",
    "Seasonal events and special drinks",
    "Relaxing gameplay with no time pressure",
    "Photo mode for sharing your cafe designs"
  ],
  "systemRequirements": {
    "minimum": {
      "os": "Windows 10 / macOS 10.13 / Web Browser",
      "processor": "Intel Core i3-4150 / AMD A8-7600",
      "memory": "2 GB RAM",
      "graphics": "DirectX 11 compatible",
      "storage": "1 GB available space"
    },
    "recommended": {
      "os": "Windows 11 / macOS 11.0 / Modern Web Browser",
      "processor": "Intel Core i5-6500 / AMD Ryzen 3 1300X",
      "memory": "4 GB RAM",
      "graphics": "NVIDIA GTX 750 / AMD RX 560",
      "storage": "2 GB available space"
    }
  },
  "links": {
    "itchio": "https://atlas-games-22.itch.io/tiny-cafe",
    "steam": "",
    "webPlay": "https://atlas-games-22.itch.io/tiny-cafe"
  },
  "credits": {
    "gameDesign": [
      "Maya Rodriguez"
    ],
    "programming": [
      "Alex Chen"
    ],
    "art": [
      "Jordan Kim"
    ],
    "audio": [
      "Emma Thompson"
    ],
    "qa": [
      "Chris Wilson"
    ]
  },
  "featured": false,
  "pitch": "Manage your own cozy cafe in this relaxing simulation game. Serve customers, customize your space, and build the perfect coffee experience.",
  "description": "Tiny Cafe offers a peaceful escape into the world of cafe management. Create the perfect coffee shop atmosphere by customizing your interior, crafting specialty drinks, and building relationships with regular customers. Each customer has unique preferences and stories, creating a warm, community-focused experience that emphasizes creativity and hospitality over stress and competition."
}