{
  "title": "Void Breaker",
  "slug": "void-breaker",
  "status": "in-development",
  "releaseDate": "2025-12-01",
  "platforms": [
    "Windows"
  ],
  "tags": [
    "Action",
    "Sci-Fi",
    "Mech",
    "Combat"
  ],
  "coverImage": "/assets/images/games/void-breaker-cover.jpg",
  "screenshots": [
    {
      "url": "/assets/images/games/void-breaker-1.jpg",
      "alt": "Void Breaker screenshot 1"
    },
    {
      "url": "/assets/images/games/void-breaker-2.jpg",
      "alt": "Void Breaker screenshot 2"
    },
    {
      "url": "/assets/images/games/void-breaker-3.jpg",
      "alt": "Void Breaker screenshot 3"
    },
    {
      "url": "/assets/images/games/void-breaker-4.jpg",
      "alt": "Void Breaker screenshot 4"
    },
    {
      "url": "/assets/images/games/void-breaker-5.jpg",
      "alt": "Void Breaker screenshot 5"
    }
  ],
  "features": [
    "Extensive mech customization system",
    "Fast-paced 3D combat mechanics",
    "Multiple dimensional environments",
    "Strategic weapon and equipment choices",
    "Boss battles against massive void entities",
    "Progression system with unlockable parts"
  ],
  "systemRequirements": {
    "minimum": {
      "os": "Windows 10",
      "processor": "Intel Core i5-8400 / AMD Ryzen 5 2600",
      "memory": "8 GB RAM",
      "graphics": "NVIDIA GTX 1060 / AMD RX 580",
      "storage": "15 GB available space"
    },
    "recommended": {
      "os": "Windows 11",
      "processor": "Intel Core i7-10700K / AMD Ryzen 7 3700X",
      "memory": "16 GB RAM",
      "graphics": "NVIDIA RTX 3070 / AMD RX 6700 XT",
      "storage": "20 GB available space (SSD recommended)"
    }
  },
  "links": {
    "itchio": "https://atlas-games-22.itch.io/void-breaker",
    "steam": "",
    "trailer": ""
  },
  "credits": {
    "gameDesign": [
      "Sam Patel",
      "Alex Chen"
    ],
    "programming": [
      "Alex Chen"
    ],
    "art": [
      "Jordan Kim"
    ],
    "audio": [
      "Emma Thompson"
    ],
    "qa": [
      "Chris Wilson"
    ]
  },
  "featured": false,
  "pitch": "A sci-fi action game where you pilot advanced mechs through dimensional rifts. Fast-paced combat meets strategic mech customization.",
  "description": "Void Breaker thrusts players into an epic sci-fi conflict where reality itself is under threat. As an elite mech pilot, you'll traverse dimensional rifts to combat an otherworldly invasion. The game combines intense real-time combat with deep mech customization, allowing players to adapt their machines for different mission types and enemy encounters. Each dimensional rift presents unique challenges and environmental hazards."
}