{
  "title": "Harvest Hustle",
  "slug": "harvest-hustle",
  "pitch": "A fast-paced farming simulation where time management meets strategic planning. Build your agricultural empire while racing against the seasons.",
  "description": "In Harvest Hustle, every second counts as you manage crops, livestock, and resources in this innovative farming simulation. Unlike traditional farming games, Harvest Hustle introduces time pressure and strategic decision-making that keeps you on your toes. Plan your seasons, optimize your farm layout, and adapt to changing weather conditions while building relationships with the local community.",
  "status": "released",
  "releaseDate": "2024-08-15",
  "platforms": ["Windows", "macOS", "Linux"],
  "tags": ["Simulation", "Strategy", "Farming", "Time Management"],
  "coverImage": "/assets/images/games/harvest-hustle-cover.jpg",
  "screenshots": [
    {
      "url": "/assets/images/games/harvest-hustle-1.jpg",
      "alt": "Harvest Hustle farm overview showing crops and buildings"
    },
    {
      "url": "/assets/images/games/harvest-hustle-2.jpg",
      "alt": "Weather system affecting crop growth in Harvest Hustle"
    },
    {
      "url": "/assets/images/games/harvest-hustle-3.jpg",
      "alt": "Community interaction and relationship building interface"
    },
    {
      "url": "/assets/images/games/harvest-hustle-4.jpg",
      "alt": "Customizable farm layout and building placement"
    },
    {
      "url": "/assets/images/games/harvest-hustle-5.jpg",
      "alt": "Leaderboards and achievement system"
    }
  ],
  "features": [
    "Dynamic weather system affecting crop growth",
    "Time-based challenges and seasonal events",
    "Extensive crop and livestock management",
    "Community relationship building",
    "Customizable farm layouts and buildings",
    "Local and online leaderboards"
  ],
  "systemRequirements": {
    "minimum": {
      "os": "Windows 10 / macOS 10.14 / Ubuntu 18.04",
      "processor": "Intel Core i3-2100 / AMD FX-4300",
      "memory": "4 GB RAM",
      "graphics": "DirectX 11 compatible",
      "storage": "2 GB available space"
    },
    "recommended": {
      "os": "Windows 11 / macOS 12.0 / Ubuntu 20.04",
      "processor": "Intel Core i5-8400 / AMD Ryzen 5 2600",
      "memory": "8 GB RAM",
      "graphics": "NVIDIA GTX 1060 / AMD RX 580",
      "storage": "4 GB available space"
    }
  },
  "links": {
    "itchio": "https://atlas-games-22.itch.io/harvest-hustle",
    "trailer": "https://www.youtube.com/watch?v=example"
  },
  "credits": {
    "gameDesign": ["Maya Rodriguez", "Sam Patel"],
    "programming": ["Alex Chen"],
    "art": ["Jordan Kim"],
    "audio": ["Emma Thompson"],
    "qa": ["Chris Wilson"]
  },
  "featured": true
}
